,essay_id,essay_set,essay,final_score,clean_essay,char_count,word_count,sent_count,avg_word_len,spell_err_count
48,49,1,"Dear local newspaper, I am writing this letter to you to show on how people get effected from computers. It effects people very well and teaches people many things for just one technology. Computers effects many people for what it does. Computers have many advantages that people learn very quickly. Many people love computers. It is one of the most best inventions to everyone around the world. They teach positive things for people to learn. Computer even have a positive effect on people across the world. They teach many things for people to learn and that have already learned. Such as, hand-eye cordination. When you type up words it teaches you to see better with your eyes. Computers also, give people the ability to see, understand, and gives information about people across the world. Celebraties are very popular on computers or other technologies. Computers help you learn things better than any other technologies. Anything you can get on any other technologies. There is a guarantee of you will find it on your computer. Computers are just like other technologies but in some categories they're much better than the others. Computers are very important in life because without computers we would not learn how to communicate with each other. If we did not have phones to use to call someone. On the computer if you go online you can maybe talk to someone by their email address. You can talk to someone that you have not talk to in years. You can look images or videos that you haven't seen in years. On computers, you can find out information from news that week of or even the day of. In conclusion all I say is that without computers in this world. What would it be like? Most technologies that are not as good computers will be popular without computers. I wonder what it will be like?",4,Dear local newspaper  I writing letter show people get effected computers  It effects people well teaches people many things one technology  Computers effects many people  Computers many advantages people learn quickly  Many people love computers  It one best inventions everyone around world  They teach positive things people learn  Computer even positive effect people across world  They teach many things people learn already learned  Such  handeye cordination  When type words teaches see better eyes  Computers also  give people ability see  understand  gives information people across world  Celebraties popular computers technologies  Computers help learn things better technologies  Anything get technologies  There guarantee find computer  Computers like technologies categories re much better others  Computers important life without computers would learn communicate  If phones use call someone  On computer go online maybe talk someone email address  You talk someone talk years  You look images videos nt seen years  On computers  find information news week even day  In conclusion I say without computers world  What would like  Most technologies good computers popular without computers  I wonder like ,1453,318,27,4.569182389937107,274
49,50,1,"Computers are the greatest tool mankind has. They give people acsess to more information than anything else in the world. they ler us connect faraway places with one click of the button without computers people would never know and learn or do as much as can without computers modern planes or cars would not exist. without computer this very test probaly would not exist so no sconclusion to much time on the computor, because theres more to do than one can doin lifetime",3,Computers greatest tool mankind  They give people acsess information anything else world  ler us connect faraway places one click button without computers people would never know learn much without computers modern planes cars would exist  without computer test probaly would exist sconclusion much time computor  theres one doin lifetime,386,83,4,4.650602409638554,72
50,51,1,"Dear Local Newspaper, Have you ever wondered how to get somewhere and you didn't have a map or near you and the only thing that was the near you was a Well I am saying you should go on it and search were you want to go. Computers are very helpful in every one's daily life they have so many facts and interesting things on them, about again trying to figure out were someone lives it's very easy, go on google and type in someones's adress and there you go. The is also very good because have you ever thought about one of your friends or a special someone and you havent seen them in like a really long time and you miss them well no problem mostley all computers have some sort of camera in them were you could video chat or just chat regular on the enternet. That is very helpful because even though you could just go on the phone and call them it's better to do it online because how about if you havent seen them you want to see a picture of them they could just send it to you on some sort of chat page or just your email. It is so much better then mailing one picture in the mail and it takes days for the mail to come if you could do it the faster way on line and on video chat it will be better.. The is also very helpful because how about one day you want to go some were and you dont know what the weather is going to be well you could go to put on the tv and see but there is so many communications and you cant really see because they move the weather days fast. On the you could type the weather in for one week and it will tell you and you could look at it for as long as you want and it will stay there so you could see the whole week without the screen having fast as the image is not in the light light or if it's to dark. The is so helpful. People do say that it is good to get off the and go for a walk outside in nature I do agree with that but people and children do get their exercising by walking around the house and going outside going shopping. Computers are helpful and nice and another thing is say one day you are online and you are looking at clothes or shoes and you want to buy them but you dont want to go to the mall a half hour away from were you live you could just buy them online and they will be shipped to your house and you dont even have to lift a fingure. They are also good because they have like a dictionary on it were if you dont know how to spell a word you type it in the best way you can and it corrects your spelling and tells you what the word is, also the computers have pictures of everything, if you want to see how something looks like you can type it in and shows you. with all the facts I have given you I hope you agree with me that computers are very helpful nice and safe.",7,Dear Local Newspaper  Have ever wondered get somewhere nt map near thing near Well I saying go search want go  Computers helpful every one s daily life many facts interesting things  trying figure someone lives s easy  go google type someones s adress go  The also good ever thought one friends special someone havent seen like really long time miss well problem mostley computers sort camera could video chat chat regular enternet  That helpful even though could go phone call s better online havent seen want see picture could send sort chat page email  It much better mailing one picture mail takes days mail come could faster way line video chat better  The also helpful one day want go dont know weather going well could go put tv see many communications cant really see move weather days fast  On could type weather one week tell could look long want stay could see whole week without screen fast image light light s dark  The helpful  People say good get go walk outside nature I agree people children get exercising walking around house going outside going shopping  Computers helpful nice another thing say one day online looking clothes shoes want buy dont want go mall half hour away live could buy online shipped house dont even lift fingure  They also good like dictionary dont know spell word type best way corrects spelling tells word  also computers pictures everything  want see something looks like type shows  facts I given I hope agree computers helpful nice safe ,2148,569,12,3.775043936731107,456
51,52,1,"Dear of society I am writing this letter to you to explain the many benefits towards computers. My first reason will explain the many ways computers help you beleive that people using computers is a very good idea. They beleive this because computers make you really focus and pay attention. This gives you really great eye sight and amazing hand eye cordonation. A important ability that computers have is they are able to teach you about far away places depending on were you live. The reason people would probobility want to visit one of these places on a website would probobility be for vacational purposes. My third reason to why I feel we should keep computers is. There is a lot of websites you can join so that you can speak to your friends as long as there online. IAM, exc. These are all great uses for computers. Also people who own a well paying email system on these computer that tells them who wants to sell a piece of machinary, or anything that involves buisness ethics. Now you know my three very important reasons to why computers are a great way to get hand eye cordonation. A great way to learn about other states. And so you can talk to friends and have a email for buisness purposes. I hope you have enjoyed reading this and hope to see you on my side toward this topic.",5,Dear society I writing letter explain many benefits towards computers  My first reason explain many ways computers help beleive people using computers good idea  They beleive computers make really focus pay attention  This gives really great eye sight amazing hand eye cordonation  A important ability computers able teach far away places depending live  The reason people would probobility want visit one places website would probobility vacational purposes  My third reason I feel keep computers  There lot websites join speak friends long online  IAM  exc  These great uses computers  Also people well paying email system computer tells wants sell piece machinary  anything involves buisness ethics  Now know three important reasons computers great way get hand eye cordonation  A great way learn states  And talk friends email buisness purposes  I hope enjoyed reading hope see side toward topic ,1041,237,15,4.3924050632911396,195
52,53,1,"Dear To begin, I understand that people don't like computers because they are over used. If the computers are so bad then they shouldn't be used, but how I see it is that they also bring more good than bad. These points to computer wellfare are they bring sourses, their is interaction between people, and computers are going to advance more over time. Even though these people think they are overused they still use them. So, even I use the computer a lot, but it could be used for good. First and foremost, these computers can get sources online that can't be found in books. Their are search engines that you can find your topics on. Then, when you find your source it has info that could have been skipped over. They can show the other side of they story that they didn't say in the book. your projects that you used to have to go to the library for you now can do from home, that itself is a step that you aren't considering. For instance if people are on a lot of the time is research. Furthermore, people can interact with friends over the computer. They can talk, send pictures, or play games. For example, i play xbox and I talk to my friends over that a lot of the time. Even a video game is fun as being with them, quoted from ""I have a computer not for friends, but for work"". This shows that even large important still use it for work. people say using a computer is like learning to ride a bike. My mom told me a story that she met my dad because he fixed her computer at her job. So, I am here with my parents because of a computer. None the less, the computers are at their begining and they will further improve. So people that are on have a reason for why they are on the computer. This advancement is going to advance again and again so there won't be a way to stop it thus, people will be on it only more and more so there is no chance of stopping the outbreak of computers. Then you will try to stop them with ""computers eat your brain"". We all know that is garbage. To conclude, I implore you not to try and change the habits of others. I that if people want to use computer they can. I say this with the sources, the friends and the advanement.",6,Dear To begin  I understand people nt like computers used  If computers bad nt used  I see also bring good bad  These points computer wellfare bring sourses  interaction people  computers going advance time  Even though people think overused still use  So  even I use computer lot  could used good  First foremost  computers get sources online ca nt found books  Their search engines find topics  Then  find source info could skipped  They show side story nt say book  projects used go library home  step nt considering  For instance people lot time research  Furthermore  people interact friends computer  They talk  send pictures  play games  For example  play xbox I talk friends lot time  Even video game fun  quoted  I computer friends  work   This shows even large important still use work  people say using computer like learning ride bike  My mom told story met dad fixed computer job  So  I parents computer  None less  computers begining improve  So people reason computer  This advancement going advance wo nt way stop thus  people chance stopping outbreak computers  Then try stop  computers eat brain   We know garbage  To conclude  I implore try change habits others  I people want use computer  I say sources  friends advanement ,1692,425,27,3.981176470588235,346
53,54,1,"Dear Local Newspaper, I am an grade student at I was reading your paper and I notice you had an article on how people are spending too much time on the computer and not enough time going outside, getting exercise, enjoying nature, and that it doesn't benifit society. i completly disagree with these comments. let me explain... Having computers definatly benifits for all students. Sometimes kids forget their text books at school. But if they have a computer, they can just google the information. That way they get there homework done, and don't have to take a zero. Another thing is, I am sure you have heard of a website called, study island. If you havn't, i'ts a website for all the students in the to take online courses for math, reading, and science. They are time consuming, but they count for a huge chunk of our grade. So, if we get an on study island we get an in one of our classes.. Not only does the computer help students but it helps me in a kind of personal way. I love the piano. But, there are no instructions in my area. However, there is a program on the computer called synewnisia. It helps you learn all kinds of songs on your keyboard or piano. The piano helps my hand-eye coordination as well as it teaches discipline and dedication. Now, synewnesia isn't the only free instrument learning program. There are many others! This helps people who can't afford lessons, and learning an instrument can help you acheive things later in life. Now, one thing you said in your article is that people aren't getting enough exercise because of sitting in front of a computer all day. This is not completly true. In fact, most people go on the computer researching diet plans or local gyms. How do I know this? Well one day when I went on google the top search of the day was, ""weight watchers diet plan"". Also, my mom uses an online video workout website, for her bad back. So not only does the computer help for diets, they can help physical therapy also. So with this letter I hope you realize that the computer does benifite our society, yes, we should not spend too much time on it. But, online learning sessions can be time consuming. It helps many people figure out the right deit and workouts so they can stay happy and healthy.",8,Dear Local Newspaper  I grade student I reading paper I notice article people spending much time computer enough time going outside  getting exercise  enjoying nature  nt benifit society  completly disagree comments  let explain  Having computers definatly benifits students  Sometimes kids forget text books school  But computer  google information  That way get homework done  nt take zero  Another thing  I sure heard website called  study island  If hav nt  its website students take online courses math  reading  science  They time consuming  count huge chunk grade  So  get study island get one classes  Not computer help students helps kind personal way  I love piano  But  instructions area  However  program computer called synewnisia  It helps learn kinds songs keyboard piano  The piano helps handeye coordination well teaches discipline dedication  Now  synewnesia nt free instrument learning program  There many others  This helps people ca nt afford lessons  learning instrument help acheive things later life  Now  one thing said article people nt getting enough exercise sitting front computer day  This completly true  In fact  people go computer researching diet plans local gyms  How I know  Well one day I went google top search day   weight watchers diet plan   Also  mom uses online video workout website  bad back  So computer help diets  help physical therapy also  So letter I hope realize computer benifite society  yes  spend much time  But  online learning sessions time consuming  It helps many people figure right deit workouts stay happy healthy ,1774,417,28,4.2541966426858515,358
54,55,1,"ARE YOU Computers are great, they're great because of these reasons. Kids can do homework on computers, also you could video chat with friends and family finally because you could look up just about anything you want on the computer. Computers are great because kids can do there homework on the computer, thats good because if they forgot there book in school or something like that then they could just get the answers of the computer. Its also good for business men because they count on computers for all there files. Computer are also great because you can video chat with friends and family. Video chatins is awesome because if a friend or relative goes out of town they could just brings there labtop of webcam and then you can talk to them whenever. Video chatins is also good for company's if there buyer is in a different country they could just video chat all the information.Finally, computers are great because they are so resourceful. There are hundreds of websites where all you have to do is type in what you want to know and there will be thousands of links for you to search and get your answer. They ere also resourceful for pictures or maybe even powerpoint presentation! In conclusion, computers are great because, kids can get there homework done, also its good for video chat finally because the internet is very resourceful.",6,ARE YOU Computers great  re great reasons  Kids homework computers  also could video chat friends family finally could look anything want computer  Computers great kids homework computer  thats good forgot book school something like could get answers computer  Its also good business men count computers files  Computer also great video chat friends family  Video chatins awesome friend relative goes town could brings labtop webcam talk whenever  Video chatins also good company s buyer different country could video chat informationFinally  computers great resourceful  There hundreds websites type want know thousands links search get answer  They ere also resourceful pictures maybe even powerpoint presentation  In conclusion  computers great  kids get homework done  also good video chat finally internet resourceful ,1094,238,10,4.5966386554621845,212
55,56,1,"Over the past decade, the percentage of people using computers has increased by approximately All of a sudden the world and its people have become dependent on information that computers provide. The variety of data bases and resources the increased communication and the skills computers allow you to portray and prove that they are essential for this generation. Communication over computers benefit now society can interact between one another. Personally I have been able to talk and see my family who live overseas through the advanced technology on computers. Different communication programs include and e-mail, the most commonly used cite. Without having access to a computer and its contents residents have a difficult time embarking themselves within the rest of society. For school events, sport schedules, and keeping in touch with far away family and friends. Computers allow all of these essentials to be part of society, and the way this generation has decided to start our lives. Paretns and teenagers these days have become very lazy in comparison to the way they used to behave. They are nit interested in going to the library in order to research information on people, places, and family heritage. Computers have been a huge convenience in a persons life by allowing all the information that was once in books to be contained throughout the internet. For example if you are doing a project for school. the internet will provide you with any information you need. It is truely astonishing how much one electronic instrument can impact and influence a life. Being a student, I am commonly curious about what references teachers are making and additional information that is not provided. The internet allows any person in possesion of a computer to research what they have wondered about and to give a response on the subject almost immediately the benefits of computers can practically cover the few negative effects as it is a way to let a person discover various information on any desired subject. Besides searching for information, computers can be used to document data of your own. Microsoft has invented several applications of which allow you to graph information design presentations, and neatly record drafts of writing. No person is flawless and is incapable of mistakes. Microsoft helps take your exentuated imperfections and hide them by doing things as little as making a neater copy of your essay, or putting your lists of data into graph form to make it more eye-friendly to viewers. Society has become reliant to sources scattered throughout the date bases on computers and by directly looking at the negative effects that a computer can have on aperson and therefore putting restrictions on this information source will enable society to have to positive donations that computers these days have on our way of life.",8,Over past decade  percentage people using computers increased approximately All sudden world people become dependent information computers provide  The variety data bases resources increased communication skills computers allow portray prove essential generation  Communication computers benefit society interact one another  Personally I able talk see family live overseas advanced technology computers  Different communication programs include email  commonly used cite  Without access computer contents residents difficult time embarking within rest society  For school events  sport schedules  keeping touch far away family friends  Computers allow essentials part society  way generation decided start lives  Paretns teenagers days become lazy comparison way used behave  They nit interested going library order research information people  places  family heritage  Computers huge convenience persons life allowing information books contained throughout internet  For example project school  internet provide information need  It truely astonishing much one electronic instrument impact influence life  Being student  I commonly curious references teachers making additional information provided  The internet allows person possesion computer research wondered give response subject almost immediately benefits computers practically cover negative effects way let person discover various information desired subject  Besides searching information  computers used document data  Microsoft invented several applications allow graph information design presentations  neatly record drafts writing  No person flawless incapable mistakes  Microsoft helps take exentuated imperfections hide things little making neater copy essay  putting lists data graph form make eyefriendly viewers  Society become reliant sources scattered throughout date bases computers directly looking negative effects computer aperson therefore putting restrictions information source enable society positive donations computers days way life ,2353,468,21,5.027777777777778,368
