,essay_id,essay_set,essay,final_score,clean_essay,char_count,word_count,sent_count,avg_word_len,spell_err_count
72,73,1,"Dear The ""@CAPS1, goes the floor. ""@CAPS4 oh here comes pete."" ""@CAPS5, is he getting fat"". ""all he does is play on the computer all day long."" is on increasing amount or teenagers throught the who are playing on the computer too much. This is needs to stop. ""@CAPS7 playing on computers is one of the worst things that they can do with their time."" of the international health committee. are always going to be obesse people around the world but in the past years has doubled the amount of obese in all of show that over of the american population is obese and very much so. The future of american is all obese lazy who only want to sit down in front of a screen all day. of who don't experience nature at a young age never fully appreciate it. Since they play on the computers all day they don't ever use nature, they won't care for it and litter and pollute even more. Just playing on the computer can be very bad for the environment like it is bad for themselves. Not only do the computers hurt the and the environment it hurts the family and friend, who are on the computer all day aren't spending enough time with their family and friends families are supposed to be close and they can't be if someone is playing on the computer all day. Just a couple of weeks ago rayfield that he got grounded because he was playing on the computer so much he didn't talk to his many in two weeks. of people who get divorced happen because of the arguements over the amount of time spent on the computer. ""@CAPS8 from the yale marriage research center. If knew that they might cause their parents to diverse they might stop playing on the computer so much. Therefore shouldn't spend that amount of time on their computer because of the health, the environment, and their families. So its up to the people really, do you want a nice physically fit nation where every family is close or and rundown obese hole in the wall that is ""called"" the",6,Dear The   CAPS  goes floor    CAPS oh comes pete     CAPS  getting fat    play computer day long   increasing amount teenagers throught playing computer much  This needs stop    CAPS playing computers one worst things time   international health committee  always going obesse people around world past years doubled amount obese show american population obese much  The future american obese lazy want sit front screen day  nt experience nature young age never fully appreciate  Since play computers day nt ever use nature  wo nt care litter pollute even  Just playing computer bad environment like bad  Not computers hurt environment hurts family friend  computer day nt spending enough time family friends families supposed close ca nt someone playing computer day  Just couple weeks ago rayfield got grounded playing computer much nt talk many two weeks  people get divorced happen arguements amount time spent computer    CAPS yale marriage research center  If knew might cause parents diverse might stop playing computer much  Therefore nt spend amount time computer health  environment  families  So people really  want nice physically fit nation every family close rundown obese hole wall  called ,1523,366,20,4.16120218579235,286
73,74,1,"I believe that computers have good effects on people. Computers allow people to stay in touch with long distance friends or family. Computers have games for kids that help them learn, and, also, people learn new things, too. My first reason is that, computers allow people to stay in touch. If someone in their family live long distance then they could always use e-mails to talk. That way they wont lose each other. Also, sometimes, friends move away and you always want to keep in touch. Another thing is that, if they want to send photos to each other, they can use e-mail. Also, because, thru an mail takes forever. Please, let the people stay in touch! My second reason is that, computers has games kids play. The games kids play could help them learn more. Sometimes watching t.v. don't help. If they acutually play the game and see what their doing, then they will got smarter. That's what we want for our kids, right? Also, kids have fun playing these games. Do you really want to take the learning experience away? My third reason is, computers help people learn new things. Like, they could go on the computer and learn what's happening in the world. People can learn new words they never knew about. Also, pictures on the computer help, too. For example, if someone is traveling somewhere, and they don't know how the price. They can get on the computer and check it out, right? So, in conclusion, I believe that computers are good use. They help people stay in touch, help kids learn by playing games and help people learn new things about the world and more. So, I'm saying, please, keep the computers. They are not a waste of our time. Turst me!",5,I believe computers good effects people  Computers allow people stay touch long distance friends family  Computers games kids help learn   also  people learn new things   My first reason  computers allow people stay touch  If someone family live long distance could always use emails talk  That way wont lose  Also  sometimes  friends move away always want keep touch  Another thing  want send photos  use email  Also   thru mail takes forever  Please  let people stay touch  My second reason  computers games kids play  The games kids play could help learn  Sometimes watching tv  nt help  If acutually play game see  got smarter  That s want kids  right  Also  kids fun playing games  Do really want take learning experience away  My third reason  computers help people learn new things  Like  could go computer learn s happening world  People learn new words never knew  Also  pictures computer help   For example  someone traveling somewhere  nt know price  They get computer check  right  So  conclusion  I believe computers good use  They help people stay touch  help kids learn playing games help people learn new things world  So  I m saying  please  keep computers  They waste time  Turst ,1297,305,29,4.252459016393443,261
74,75,1,"Dear In the past ten years, advances in technology have completely changed the world. Technology makes peoples lives much easier and helps keep more and more people connected throughout the world. More jobs are created and help speed up ordinary events such as taxes, messages, news, and teaching. However, many people have proven that too much use of technology can make teens and adults addicted to the internet. In this addiction many people can lose time with their family, time to exercise and enjoy nature. Since being part of the generation growing up in the new technology era, I have had a first hand experience with the benifits of the new technology. I believe that this technology is a great help to society today. Many more jobs are being created because of this technology. For example, think about how many people could be employed if a new computer system was created. There would be thousands of people working on many things such as the founder, manager, creater of new ideas or just working at the new companies retail store. Running a business or a corporation is a very difficult job to do. But because of the advances in technology, running a business can become much easier and not as much time is wasted. With the new technology, people can send emails within seconds instead of running around the entire office giving out memos. Also for businesses, their stocks of the company can be updated every minute. These advances will make easier to run and make them more efficent. With the advances in technology average people can be updated on the new around the world every minute. Also when it comes time to pay taxes, fill them out and pay on line. None the less, there is more entertainment open to everyone. Through todays new technology, peoples lives are made much easier. They can work faster, get more arrands accomplished, learn more, connect to people around the world, and be caught up with local and international news. Technology is benifiting society and will hopefully continue making life easier.",6,Dear In past ten years  advances technology completely changed world  Technology makes peoples lives much easier helps keep people connected throughout world  More jobs created help speed ordinary events taxes  messages  news  teaching  However  many people proven much use technology make teens adults addicted internet  In addiction many people lose time family  time exercise enjoy nature  Since part generation growing new technology era  I first hand experience benifits new technology  I believe technology great help society today  Many jobs created technology  For example  think many people could employed new computer system created  There would thousands people working many things founder  manager  creater new ideas working new companies retail store  Running business corporation difficult job  But advances technology  running business become much easier much time wasted  With new technology  people send emails within seconds instead running around entire office giving memos  Also businesses  stocks company updated every minute  These advances make easier run make efficent  With advances technology average people updated new around world every minute  Also comes time pay taxes  fill pay line  None less  entertainment open everyone  Through todays new technology  peoples lives made much easier  They work faster  get arrands accomplished  learn  connect people around world  caught local international news  Technology benifiting society hopefully continue making life easier ,1647,347,21,4.746397694524496,274
75,76,1,"Dear local newspaper, best friend, was once a nerd with no hand-eye coordination, he started to use a computer and now he has better hand-eye coordination than me. Computer not only teaches hand-eye coordination, but gives people the ability to learn about far away places and people,and millons people to talk on line with other people. friend wasn't the only person who learn hand-eye coordination. About of people learn hand-eyes coordination using a computer. might takes some month to learn, but once a child knows they will be outside for hours. Who would not want to learn hand-eye coordination? In addition, computer gives people the ability to learn about far away places and people. Computer engineer, says, ""@NUM1 in every people learn about places and people threw the internet."" will take a few hours, but you will be educated. Why would someone think we are spending too much time in the internet if we are being educated? Addionally, don't you have a friend who live more than miles away from you? If you do, a computer will solve your problem of communication. friend, lives miles away from me. We communicate using hotmail, yahoo, and facebook. The best thing of all is that is free unlike a telephone. Futhermore, computer specialist, says, ""I learned hand-eye coordination using a computer. Most importantly, i was able to hand in essay on time because of the information a computer provides and i was able to communicate with family."" I didn't want to tell you this, but i was also a nerd with no hand-eye coordination and i learned just like learned. We aren't spending too much time, we are just being educated.",6,Dear local newspaper  best friend  nerd handeye coordination  started use computer better handeye coordination  Computer teaches handeye coordination  gives people ability learn far away places people  millons people talk line people  friend nt person learn handeye coordination  About people learn handeyes coordination using computer  might takes month learn  child knows outside hours  Who would want learn handeye coordination  In addition  computer gives people ability learn far away places people  Computer engineer  says    NUM every people learn places people threw internet   take hours  educated  Why would someone think spending much time internet educated  Addionally  nt friend live miles away  If  computer solve problem communication  friend  lives miles away  We communicate using hotmail  yahoo  facebook  The best thing free unlike telephone  Futhermore  computer specialist  says   I learned handeye coordination using computer  Most importantly  able hand essay time information computer provides able communicate family   I nt want tell  also nerd handeye coordination learned like learned  We nt spending much time  educated ,1299,291,19,4.463917525773196,236
76,77,1,"Dear Newspaper, In world we are dependent on computers. computers have become the most helpful source of technology. We need computers for so many things, and they benefit society. They can help people talk online, they're educational, and they improve hand eye cordination. It has been amazing how computers help us so much. We need computers like we need water. If we didn't how would we survive? Computers have become the glue to friendships. They help keep friendships when you don't see the friend constantly. I have a friend that moved to last year. It was way too expensive to just call ot text her. So as a result, I keep in contact with her through the computer. Everyday we and use skype to keep intouch. Those cost per year. If I were to call her each call would cost if it weren't for the internet I seriously know that our friendship would collapse. Computers have been so helpful for many people with this same problem. Computers have become the number one source to find information. They have become more popular than the library and text books combined. So many essential resources are on computers. Text books, calculators, and even homework are online. Many people say that computers aren't educational, but scientists say it can move a students grade from a to an A+. Teachers say the same thing too. one of my fellow students said that computers changed his life. He used to be forgetting to write down his homework, but he looks online and he has all of it. Now he knows what pages to read from the science book. If you don't think that computers have changed students lives, well think again. There are also games that improves hand eye cordination. Many sports teams like the use this. It has increased there hand eye cordination by the team says if it wasn't for the hand eye cordination game, then they would have never have won the this game is also free online for anyone to use. Everyone that has used it said it really improved there reaction time. The games are also fun and non violent. They have games like baseball, hockey, and hurdles. This game has made a great improvement on people's lives. If we don't have computers then our hand eye cordination will decrease by would you want to be the person to take away computers? In conclusions computers have made a great impact on society. Computers are educational, you get to talk to friends, and improve your hand eye cordination. Computers have made a big improvement on how we live, and it's for the better. If we didn't have computers then friendships would break, grades would decrease, and hand eye cordination would plummit. We need computers they have been so beneficial to billions of people across the globe. Many people depend on computers. So if we take away computers then you'll be letting many lives down. No sane person would want to take away computers. Computers have benifited society in so many ways.",8,Dear Newspaper  In world dependent computers  computers become helpful source technology  We need computers many things  benefit society  They help people talk online  re educational  improve hand eye cordination  It amazing computers help us much  We need computers like need water  If nt would survive  Computers become glue friendships  They help keep friendships nt see friend constantly  I friend moved last year  It way expensive call ot text  So result  I keep contact computer  Everyday use skype keep intouch  Those cost per year  If I call call would cost nt internet I seriously know friendship would collapse  Computers helpful many people problem  Computers become number one source find information  They become popular library text books combined  So many essential resources computers  Text books  calculators  even homework online  Many people say computers nt educational  scientists say move students grade A  Teachers say thing  one fellow students said computers changed life  He used forgetting write homework  looks online  Now knows pages read science book  If nt think computers changed students lives  well think  There also games improves hand eye cordination  Many sports teams like use  It increased hand eye cordination team says nt hand eye cordination game  would never game also free online anyone use  Everyone used said really improved reaction time  The games also fun non violent  They games like baseball  hockey  hurdles  This game made great improvement people s lives  If nt computers hand eye cordination decrease would want person take away computers  In conclusions computers made great impact society  Computers educational  get talk friends  improve hand eye cordination  Computers made big improvement live  s better  If nt computers friendships would break  grades would decrease  hand eye cordination would plummit  We need computers beneficial billions people across globe  Many people depend computers  So take away computers ll letting many lives  No sane person would want take away computers  Computers benifited society many ways ,2321,521,43,4.45489443378119,442
77,78,1,"Dear Local Newspaper, opinion for using ""too much"" computer time is an outrage. I think people should have more ideas. Such as as exercise, socialize with family and friends, and lastly, ""you time"" which means to do whatever you would like to do indoors BUT computers. For excersice you can do any sport that you like outside. For and spending time with family and friends you can have a nice family reunion at their house just ""hangout with your friends. Four ""you time you can draw, read a book. Their is a lot of ideas instead of ""computer time the time!"" With exercising can go outside and play sport such as basketball, soccer baseball, etc. You could even play hide and seek with your friends even tag. Anything that keeps you moving out of the house ins tead of using computers! If you exercise everyday such as ""workout"" to get fit you will definatelly manage that instead of using ""computer time"". Exercising is a good idea ins tead of using ""computer time!"" with family and friends is a good use instead of ""computer time because you can finally have the time to spend time with then like talk to them, play games eat dinner together. That's called ""@CAPS3"" Your family friends will love to spend time together by eating dinner together and have a nice conversation. You could also play any board games such as ""monopoly"" too. With your friends you ran go to the movies, have a sleepover play outside. Many good little ideas to do with family and friends instead of using ""computer time."" The last idea for ins tead of using ""computer time"" lis doing ""you time indoors. WARNING! But computer time! You could do something quite like draw a nice picture. That's something nice and quite to do instead of using ""computer time."" you could even read a book too. Maybe you have to catch up on your nightly reading for language arts and you want start reading your goal book. If you choose to do ""you time, you will definately manage to undo that useless ""computer time!"" of these ""ideas"" for not using the computer is very easy. It's not healthey to sit around the computer day! Instead you can exercise. You could also socialize with family and friends. Lastly, do ""you time. but don't use a computer!!! If you want to achieve a goal you can mange that!!!",8,Dear Local Newspaper  opinion using  much  computer time outrage  I think people ideas  Such exercise  socialize family friends  lastly   time  means whatever would like indoors BUT computers  For excersice sport like outside  For spending time family friends nice family reunion house  hangout friends  Four  time draw  read book  Their lot ideas instead  computer time time   With exercising go outside play sport basketball  soccer baseball  etc  You could even play hide seek friends even tag  Anything keeps moving house ins tead using computers  If exercise everyday  workout  get fit definatelly manage instead using  computer time   Exercising good idea ins tead using  computer time   family friends good use instead  computer time finally time spend time like talk  play games eat dinner together  That s called   CAPS  Your family friends love spend time together eating dinner together nice conversation  You could also play board games  monopoly   With friends ran go movies  sleepover play outside  Many good little ideas family friends instead using  computer time   The last idea ins tead using  computer time  lis  time indoors  WARNING  But computer time  You could something quite like draw nice picture  That s something nice quite instead using  computer time   could even read book  Maybe catch nightly reading language arts want start reading goal book  If choose  time  definately manage undo useless  computer time    ideas  using computer easy  It s healthey sit around computer day  Instead exercise  You could also socialize family friends  Lastly   time  nt use computer    If want achieve goal mange   ,1773,408,33,4.345588235294118,350
78,79,1,"Computers have caused many people money, friends and time. In fact, since that the computers came out this year, lots of people has been spending web to much time of them. Which can cause people to loose time and friends. Computers and technology today have had a very influence on very many people. Spending too much time on computers can cause to loose time and money. For example, my oldest brother was very large at the age of or because our computer started working, but this had a positive impact on him, he started participating in sports such as basketball and lacrosse and that he was very at them and followed lacrosse through highschool. While doing this he and saves my parents money. This is reason how computers have had a negative effect on people. The new technology has caused people to loose lots of time when they could be doing other things that would them in life. For example, many people in the have half of their day to computers, and not getting the exercise of this are video games of the day on computers. This is affect that computers can have on people is loosing or with friends. For example, I used to be friends a person, but then he did not talk to me for almost the entire because he was always on the computer, which made me think that he did not want to be friends but actually he just deleted almost all of the the to the computer. Since this helped I have been over to his house about times this year as to every This is way computers can change your life. The time has come to decide whether to have a computer or not to have in computers. In my mind I that it would be best for everyone if we did not have the on computers, but if you do that we should have the an computers than put a certain time wait on computers. In your so you and your family members don't loose time, exercise time, or friends. Overall, I think that it would be best for everyone if we had a time on computers to the whole day on them.",8,Computers caused many people money  friends time  In fact  since computers came year  lots people spending web much time  Which cause people loose time friends  Computers technology today influence many people  Spending much time computers cause loose time money  For example  oldest brother large age computer started working  positive impact  started participating sports basketball lacrosse followed lacrosse highschool  While saves parents money  This reason computers negative effect people  The new technology caused people loose lots time could things would life  For example  many people half day computers  getting exercise video games day computers  This affect computers people loosing friends  For example  I used friends person  talk almost entire always computer  made think want friends actually deleted almost computer  Since helped I house times year every This way computers change life  The time come decide whether computer computers  In mind I would best everyone computers  computers put certain time wait computers  In family members nt loose time  exercise time  friends  Overall  I think would best everyone time computers whole day ,1546,372,17,4.155913978494624,293
